Repository Name,Type,Primary Language,Purpose,Role,Priority,Dependencies Count,Publication Targets Count,Dependencies,Publication Targets,Artifacts
mcp-prompts,metarepository,YAML/Shell,"Metarepozitář: verzuje společné CI skripty, docker-compose scénáře, dokumentaci a release orchestrace",orchestrator,critical,1,2,all_repos,"GitHub Actions, Docker Hub","GitHub Actions workflows, Docker images (suite), Documentation"
mcp-prompts-catalog,data_repository,JSON/Markdown,Single source of truth pro všechny prompty ve formátu JSON/MDC,data_source,critical,0,2,None,"NPM, Git tags","JSON prompts, MDC templates, Documentation"
mcp-prompts-ts,server_implementation,TypeScript,Referenční TypeScript server (dnešní obsah repozitáře),reference_implementation,critical,1,2,mcp-prompts-catalog,"NPM, Docker Hub","NPM package, Docker image, Type definitions"
mcp-prompts-rs,server_implementation,Rust,Výkonná Rust implementace se stejným API,performance_implementation,high,1,2,mcp-prompts-catalog,"crates.io, Docker Hub","Crate, Docker image, Binary"
mcp-prompts-pg,server_implementation,TypeScript,Postgres-first varianta stavějící na rozšířeném PG MCP serveru,database_implementation,medium,2,2,"mcp-prompts-catalog, postgresql","NPM, Helm Hub","NPM package, Helm chart, SQL migrations"
mcp-prompts-aidl,platform_integration,Rust/Kotlin,"Android integrační vrstva: Rust micro-service, AIDL kontrakty, Tasker profily a demo chatbot",platform_adapter,medium,2,2,"mcp-prompts-catalog, mcp-prompts-rs","Maven Central, Google Play","Android AAR, Gradle library, Docker image"
mcp-prompts-py,server_implementation,Python,Python port s funkcionalitou shodnou s TS/RS verzí (budoucí),python_implementation,low,1,2,mcp-prompts-catalog,"PyPI, Docker Hub","PyPI package, Docker image, Type stubs"
